Unnamed: 0,Jacket,Upper,Lower,Shoes,TryOnImage,Style,Occasion,JacketName,JacketColor,JacketPattern,JacketSleeves,JacketCollar,JacketType,JacketType2,JacketShape,JacketMaterial,JacketFAB,UpperName,UpperColor,UpperPattern,UpperSleeves,UpperCollar,UpperType,UpperType2,UpperShape,UpperMaterial,UpperFAB,LowerName,LowerColor,LowerPattern,LowerSleeves,LowerCollar,LowerType,LowerType2,LowerShape,LowerMaterial,LowerFAB,ShoesName,ShoesColor,ShoesPattern,ShoesSleeves,ShoesCollar,ShoesType,ShoesType2,ShoesShape,ShoesMaterial,ShoesFAB
Outfit 1,,RR1256220624B,RR1256410810,RR1256722501,https://maistyle01.oss-cn-shanghai.aliyuncs.com/outfit_tryon/man/Outfit%201/upload_man_outfit1.jpg,日常休闲,"日常休闲, 周末早午餐",,,,,,,,,,,长袖T恤,浅蓝,胸口与袖口同色低调印花,长袖,半高领,T恤,上装,修身版SlimFit,面料：51%腈纶 ，41%莫代尔纤维  8%氨纶,面料FAB：进口rich warmth蓄热磨毛面料，保暖透气，锁住体温，创新膨体纤维，手感蓬松，质地柔软纤细的特殊起毛工艺，杜绝不均，绒面更自然，出色的抗起球性，可机洗设计FAB：吸睛的冬日热烈橙色，保暖不臃肿，单穿搭配牛仔，简单利落，马甲夹克叠穿，增加层次感。柔软亲肤的特性也同时适合居家穿着，适应多种气温变化的穿着场合工艺FAB：顺色IP形象植绒，手感柔软舒适有微弹，贴合面料，没有异物感,牛仔裤(水洗产品),中牛仔蓝,数码像素拼接洗水,长裤,—,牛仔裤,下装,潮流版TrendyFit,面料：90.3%棉，8.7%聚酯纤维，1%氨纶,面料FAB：经典棉氨成分面料。棉是一种天然纤维，具有良好的柔软性和亲肤性，穿着非常舒适。其多孔结构允许空气流通，有助于吸湿排汗，保持穿着者的干爽舒适。氨纶的加入为牛仔布提供了额外的弹性，使得裤子或衣物可以更好地贴合身体曲线，提供更好的活动自由度并增加其耐磨性。设计FAB：创新款，结构上打破常规牛仔五袋款是制式，偏移的口袋以及休闲感的牛仔插袋搭配工装袋襻儿增添时尚感。工艺FAB：局部马赛克运用多重工艺：激光，印花和绣花去展示主题图案。精致切割logo更显品质潮流。,休闲鞋,深蓝 + 白色,经典拼色 + 字母徽标,—,—,鞋,鞋履,,牛皮革+织物,设计FAB：延续经典楦型，以牛仔蓝色的粒面牛皮革为主材，独特的色调与质感，可搭配同色系服饰，展现出低调而富有品味的时尚态度。鞋面点缀了花卉与品牌LOGO的艺术图案，精致的设计语言融合现代工艺，使整体造型更具辨识度。鞋材FAB：鞋底采用品牌定向研发的高性能橡胶材质，底花设计以双R交织而成，既提供卓越的防滑耐磨性能，又增添独特的品牌印记。中底内置PU缓震垫，为步伐提供有力的回弹支撑，兼具缓冲与减震功能，提升长时间穿着的舒适性。鞋舌与鞋口填充12mm空气棉，有效贴合脚型，带来柔软包裹感。内里采用轻盈透气的白色网布，增强透气性，避免闷热感，使步履更为轻松自在。鞋带选用耐磨的混纺材质，经过特殊工艺处理，不易松脱，确保稳固贴合。工艺FAB：独具匠心的五种针法交替运用，使鞋面细节更具层次感。幻彩线的加入，使鞋款在不同光线角度下折射出丰富的色彩变化，展现微妙的光影效果。品牌LOGO采用纯手工缝制的米珠工艺，每颗米珠紧密排列，并搭配银色珠片绣，增强视觉立体感，同时提升鞋款的精致度与价值感。
Outfit 2,RR0000000001,RR1256261513A,RR0000000002,RR1256711526,https://maistyle01.oss-cn-shanghai.aliyuncs.com/outfit_tryon/man/Outfit%202/upload_man_outfit2.jpg,商务正装,商务晚宴,西服,经典黑,微立体菱格暗纹,长袖,翻领西装,夹克,上装,,,,长袖衬衫,白色,几何压花暗纹,长袖,翻领衬衫,衬衫,上装,舒适版RegularFit,59%棉 41%莱赛尔纤维,"设计FAB：品牌自主定织的白色提花面料，菱形块面提花，通过不同的组织肌理提花让面料在不同的角度有低调的色泽变化，布面精致而细腻；棉和莱赛尔混纺，弹力较好，穿着更舒适。面料FAB：棉和莱赛尔混纺，它具有柔软的手感、良好的吸湿性和透气性，并且对环境友好。莱赛尔纤维常被用于与棉（Cotton, 简称C）等其他天然或合成纤维混纺，以提高面料的整体性能和舒适度。工艺FAB：采用成衣免烫工艺，达到国家成衣免烫的最高标准DP4.0，面料经过特殊药水处理，制作时在缝合部位（领边、肩缝、袖笼、侧缝等处）粘嵌条，采用先进的全方位立体塑形使棉纤维的分子之间产生交联记忆，从而达到免烫效果；相当于给衬衫一副骨架，在水洗后仍能保持立体的造型，并且穿着起皱后经过几个小时的悬挂，会自行恢复平整。",西裤,经典黑,纯色无纹理,—,—,夹克,上装,,,,皮鞋,亮黑,纯色漆皮光泽 + 金属装饰,—,—,鞋,鞋履,,牛皮革,设计FAB：乐福鞋采用黑色开边珠牛皮革，质感细腻且富有光泽，展现低调奢华的风格。带袢处金色装饰标增添精致感，同时优化视觉层次，使整体造型更具辨识度。杏仁头鞋楦修饰脚型，拉长腿部比例，营造挺拔利落的绅士风范。鞋材FAB：鞋底选用意大利XL EXTRALIGHT？品牌鞋底，采用EVA发泡材质，兼具轻盈性与回弹力，有效缓冲步行时的冲击，减少足部疲劳。内里采用黑色牛皮革，柔韧透气，增强穿着舒适度，同时提升鞋款的整体耐用性。工艺FAB：黑色开边珠牛皮革经过多道精细打磨工艺处理，确保皮革光泽自然且耐用。金色装饰标采用高精度金属工艺，质感细腻，细节考究。EVA发泡鞋底通过一体成型工艺制造，既保证轻量化，又增强耐磨性与抓地力，使步履更加稳定流畅。
Outfit 3,RR1256162757,RR1256210633,RR1256430757,RR1256722511,https://maistyle01.oss-cn-shanghai.aliyuncs.com/outfit_tryon/man/Outfit%203/upload_man_outfit3.jpg,日常休闲,"旅行, 日常休闲",休闲外套,白色,细微同色纹理,长袖,立领（简洁无翻）,夹克,上装,舒适版RegularFit,面料：29.6%棉  29.1%锦纶 ，19.3%聚酯纤维  17.9%莫代尔  4.1%氨纶，里布：100%聚酯纤维,面料FAB：棉混纺成分面料。棉是一种天然纤维，具有良好的柔软性和亲肤性，吸湿排汗，穿着非常舒适。布面是极细的精致提花，图案采用经典logoRARE进行变化重组，满版图案但隐约一体。视觉效果干净但有内容。设计FAB：白色提花款立领休闲外套。区别于常规的下摆松紧外套，此款下摆采用拼接的设计手法，前幅双层下摆，底拼接化纤增加变化，针织立领亲肤舒适，精神焕发。经典版型穿着合体舒适。适合游玩，踏青等休闲场合穿着。,短袖T恤,深海军蓝,暗纹方格拼接,短袖,圆领,T恤,上装,舒适版RegularFit,面料：毛绒：62.1%棉 ，37.9%莫代尔，底布：69.1%聚酯纤维，19.2%棉   11.7%莫代尔,设计FAB：几何色块和logo结合，从上到下从有到无做了渐变，实现富有变化的肌理提花面料FAB：定位暗肌理提花，马赛克格形。低调奢华，精致高级感，在秋日季节，实现温度与风度并存工艺FAB：28支雪尼尔纱线，空气绒提花，质地轻盈，特殊交织提花方法，机洗手洗都不掉绒,针织裤,白色,纯色无图案,长裤（直筒休闲裤）,松紧抽绳,长裤,下装,舒适版RegularFit,面料：29.6%棉  29.1%锦纶 ，19.3%聚酯纤维  17.9%莫代尔 ，4.1%氨纶,面料FAB：棉混纺成分面料。棉是一种天然纤维，具有良好的柔软性和亲肤性，吸湿排汗，穿着非常舒适。布面是极细的精致提花，图案采用经典logoRARE进行变化重组，满版图案但隐约一体。视觉效果干净但有内容。设计FAB：斜插袋款直出针织裤。松紧腰头满足男士穿着需求，易于穿脱，松紧抽绳便于固定。直出版精雕细琢，修饰身型，落落得体。白色经典常青色，易搭配，适合春夏踏青等户外休闲运动。,休闲鞋,灰白 + 黑色,拼色 + 字母徽标,—,—,鞋,鞋履,,牛皮革+织物,设计FAB：延续Rich系列经典鞋型，这款鞋子在本季升级为中帮造型，适应秋冬季节的需求，既具备保暖性，又充满现代感。精致的灰色系搭配，提升整体的优雅气质，低调的奢华感尽显。鞋款将传统工艺与运动元素结合，不仅具备出色的功能性，还突显独特的时尚气息，满足精致且追求个性化的消费者需求。鞋材FAB：鞋面主料选用头层磨砂牛皮革，五种材质的拼接，灰色调搭配沉稳典雅，呈现出质感十足的视觉效果。内里使用白色网布，增强透气性与舒适感，确保长时间穿着的舒适性。鞋底采用经典的双R橡胶大底与PU中底组合，带来良好的缓震效果和耐磨性，适合各种场合穿着。工艺FAB：鞋面特别的工艺片采用珠片绣、立体绣与米珠绣的精湛工艺组合，层次丰富且充满匠心，细致的刺绣和珠饰展示了高端工艺的独特魅力。每一处缝制都体现出品牌对工艺的严格要求。整体设计在时尚感与功能性之间找到了完美的平衡，细节精致，品质感十足。
Outfit 4,,RR1256261526A,RR0000000004,RR0000000016,https://maistyle01.oss-cn-shanghai.aliyuncs.com/outfit_tryon/man/Outfit%204/upload_man_outfit4.jpg,商务休闲,"办公室, 约会夜晚",,,,,,,,,,,长袖衬衫,白色,同色系立体钥匙印花,长袖,翻领衬衫,衬衫,上装,舒适版RegularFit,底布:51%粘纤 45%聚酯纤维， 4%氨纶，植绒:100%锦纶,面料FAB：面料含有竹纤维，竹纤维具有天然的抗菌性能，能够有效抑制细菌生长，有助于保持衣物清洁。竹纤维质地柔软光滑，对皮肤友好。氨纶的加入赋予面料一定的弹力，使得衬衫更加贴合身体曲线，同时不影响活动自由度。工艺FAB：满版提花加植绒的工艺织造，满版提花工艺能够在面料表面形成连续且复杂的图案，增加了服装的艺术感和高级感。植绒处理不仅提升了视觉上的吸引力，还让面料拥有更柔软的手感，进一步增强了穿着的舒适度。,西裤,米白,纯色细腻织纹,—,—,夹克,上装,,,,皮鞋,深棕渐变,手工擦色+微雕花纹,—,—,鞋,鞋履,,,
Outfit 5,RR1256181514,RR1256210610A,RR0000000008,RR0000000017,https://maistyle01.oss-cn-shanghai.aliyuncs.com/outfit_tryon/man/Outfit%205/upload_man_outfit5.jpg,商务休闲,"办公室, 商务晚宴, 鸡尾酒活动",西服,深藏蓝,纯色,长袖,翻领西装,夹克,上装,修身版SlimFit,面料：98%山羊绒  2%羊毛，里料：52%聚酯纤维  48%粘纤,1、设计FAB：简约两粒扣设计，手巾袋绣花点缀穿着既有一定的正式感又有设计感，彰显穿着者的品味。高端的材质更显高级感。2、面料FAB：全羊绒手感柔软亲肤,短袖T恤,白色,肩口与下摆同色压花钥匙图案,短袖,圆领,T恤,上装,舒适版RegularFit,面料：36.4%莫代尔， 25.7%粘纤，21.7%聚酯纤维 ，10.8%腈纶， 5.4%氨纶,设计FAB：采用了新的上下工艺呼应的新颖排布方式，低调又灵动面料FAB：云柔双面空气棉，软软糯糯的呼吸感，云朵般的舒适，面料正反一致，上身轻盈，细腻丝滑，具有轻、软、挺的特质工艺FAB：经典品质绣花款T恤，采用主题钥匙图案，绣花工艺与亮片与烫钻叠加，凸显价值感，采用了新的上下工艺呼应的排布方式，低调又灵动,西裤,暗夜黑,竖条纹,—,—,夹克,上装,,,,休闲鞋,黑色,细纹牛皮+同色镶边,—,—,鞋,鞋履,,,
Outfit 6,,RR1256241557,RR0000000002,RR0000000015,https://maistyle01.oss-cn-shanghai.aliyuncs.com/outfit_tryon/man/Outfit%206/upload_man_outfit6.jpg,精致休闲,"约会夜晚, 周末早午餐",,,,,,,,,,,长袖毛衫,黑色,胸口同色立体绣花小图案（熊头像）,长袖,圆领,,上装,舒适版RegularFit,主料：88.5%绵羊毛 11.5%聚酯纤维，下摆罗纹：，81.3%绵羊毛 18.7%锦纶,设计FAB：黑色粗纺羊毛衫是秋冬季节更符合潮流趋势的时尚单品之一。选用9针的厚薄，搭配前片潮流时尚的IP立体压印叠加刺绣烫钻工艺，年轻潮流又不失品质的工艺款毛衫。面料FAB：精选2/26的粗纺羊毛，手感蓬松柔软，穿着起来挺括有型更具年轻潮流时尚感。工艺FAB：前胸中小图案的形式适穿性更强，以趣味性的IP狮子头图案形式极具品牌特色又充满了时尚趣味感。以立体的压印和刺绣工艺，更符合年轻潮流的工艺形式。,西裤,经典黑,纯色无纹理,—,—,夹克,上装,,,,皮鞋,黑色,镂空打孔皮革,—,—,鞋,鞋履,,,
Outfit 7,RR1256181514,RR1256261526A,RR0000000006,RR0000000017,https://maistyle01.oss-cn-shanghai.aliyuncs.com/outfit_tryon/man/Outfit%207/upload_man_outfit7.jpg,商务正装,"商务晚宴, 婚礼嘉宾",西服,深藏蓝,纯色,长袖,翻领西装,夹克,上装,修身版SlimFit,面料：98%山羊绒  2%羊毛，里料：52%聚酯纤维  48%粘纤,1、设计FAB：简约两粒扣设计，手巾袋绣花点缀穿着既有一定的正式感又有设计感，彰显穿着者的品味。高端的材质更显高级感。2、面料FAB：全羊绒手感柔软亲肤,长袖衬衫,白色,同色系立体钥匙印花,长袖,翻领衬衫,衬衫,上装,舒适版RegularFit,底布:51%粘纤 45%聚酯纤维， 4%氨纶，植绒:100%锦纶,面料FAB：面料含有竹纤维，竹纤维具有天然的抗菌性能，能够有效抑制细菌生长，有助于保持衣物清洁。竹纤维质地柔软光滑，对皮肤友好。氨纶的加入赋予面料一定的弹力，使得衬衫更加贴合身体曲线，同时不影响活动自由度。工艺FAB：满版提花加植绒的工艺织造，满版提花工艺能够在面料表面形成连续且复杂的图案，增加了服装的艺术感和高级感。植绒处理不仅提升了视觉上的吸引力，还让面料拥有更柔软的手感，进一步增强了穿着的舒适度。,西裤,深藏蓝,纯色无图案,—,—,夹克,上装,,,,休闲鞋,黑色,细纹牛皮+同色镶边,—,—,鞋,鞋履,,,
Outfit 8,RR0000000009,RR1256261513A,RR0000000010,RR0000000013,https://maistyle01.oss-cn-shanghai.aliyuncs.com/outfit_tryon/man/Outfit%208/upload_man_outfit8.jpg,商务正装,"商务晚宴, 婚礼嘉宾",西服,雾感灰,竖向细条纹,长袖,翻领西装,夹克,上装,,,,长袖衬衫,白色,几何压花暗纹,长袖,翻领衬衫,衬衫,上装,舒适版RegularFit,59%棉 41%莱赛尔纤维,"设计FAB：品牌自主定织的白色提花面料，菱形块面提花，通过不同的组织肌理提花让面料在不同的角度有低调的色泽变化，布面精致而细腻；棉和莱赛尔混纺，弹力较好，穿着更舒适。面料FAB：棉和莱赛尔混纺，它具有柔软的手感、良好的吸湿性和透气性，并且对环境友好。莱赛尔纤维常被用于与棉（Cotton, 简称C）等其他天然或合成纤维混纺，以提高面料的整体性能和舒适度。工艺FAB：采用成衣免烫工艺，达到国家成衣免烫的最高标准DP4.0，面料经过特殊药水处理，制作时在缝合部位（领边、肩缝、袖笼、侧缝等处）粘嵌条，采用先进的全方位立体塑形使棉纤维的分子之间产生交联记忆，从而达到免烫效果；相当于给衬衫一副骨架，在水洗后仍能保持立体的造型，并且穿着起皱后经过几个小时的悬挂，会自行恢复平整。",西裤,雾感灰,竖向细条纹,—,—,夹克,上装,,,,皮鞋,黑色,经典鳄鱼压纹+金属马衔扣,—,—,鞋,鞋履,,,
Outfit 10,RR1256160502,RR1256210610A,RR1256420502,RR1256722514,https://maistyle01.oss-cn-shanghai.aliyuncs.com/outfit_tryon/man/Outfit%2010/upload_man_outfit10.jpg,日常休闲,"旅行, 日常休闲",夹克,深夜蓝,细致压花拼接,长袖,连帽立领,夹克,上装,宽松版LooseFit,面料1：49%粘纤 ，45%聚酯纤维  6%氨纶，面料2：100%锦纶,1、设计FAB：藏青色连帽百搭款，前胸绣花标采用辫子针铺底，牙刷绣与包针的结合，有光线与无光线的结合凸显趣味性。2、工艺FAB：采用双层工艺做法针梭织拼，针织部分内层是梭织，梭织部分内层是针织。双层做法使夹克更显品质感。3、面料FAB：梭织部分采用圣彼得钥匙大提花排列的抗皱提花面料，拼接超轻薄空气层针织面料，手感非常爽滑，无龄感的版型结合弹力面料更为实穿。,短袖T恤,白色,肩口与下摆同色压花钥匙图案,短袖,圆领,T恤,上装,舒适版RegularFit,面料：36.4%莫代尔， 25.7%粘纤，21.7%聚酯纤维 ，10.8%腈纶， 5.4%氨纶,设计FAB：采用了新的上下工艺呼应的新颖排布方式，低调又灵动面料FAB：云柔双面空气棉，软软糯糯的呼吸感，云朵般的舒适，面料正反一致，上身轻盈，细腻丝滑，具有轻、软、挺的特质工艺FAB：经典品质绣花款T恤，采用主题钥匙图案，绣花工艺与亮片与烫钻叠加，凸显价值感，采用了新的上下工艺呼应的排布方式，低调又灵动,休闲裤,深夜蓝,局部异材质拼接（侧片压花）,长裤（束脚）,松紧抽绳,长裤,下装,宽松版LooseFit,面料：49%粘纤 ，45%聚酯纤维 6%氨纶，配料：100%锦纶,工艺FAB：超薄空气层针织面料，手感爽滑，在后机头侧缝处拼接梭织面料，双层做法使休闲裤更显品质感。面料FAB：梭织部分采用圣彼得钥匙大提花排列的抗皱提花面料，拼接超轻薄空气层针织面料，手感非常爽滑，无龄感的版型结合弹力面料更为实穿设计FAB：袋口绣花标采用辫子针铺底，牙刷绣与包针的结合，有光线与无光线的结合凸显趣味性。,休闲鞋,白色,拼接材质 + 压纹字母,—,—,鞋,鞋履,,牛皮革+织物,设计FAB：延续经典运动风格，25秋冬系列创新设计。相较于前代款式，此款鞋楦的廓形略大，旨在提升舒适感的同时赋予鞋款更加现代的时尚感。鞋身采用轻量化优化设计，内里填充高密度空气棉，提供极致的舒适性与包裹感，适合长时间穿着。整体设计通过复古风格拼接与现代工艺的结合，呈现出低调奢华的视觉效果，兼具功能性与时尚感，白色系配色百搭性强，能轻松与各种风格的服饰搭配，满足多种场合需求。鞋材FAB：鞋面采用高品质头层牛皮革，质感上乘，展现出经典与现代兼备的风格。鞋底部分采用了双色橡胶与超轻发泡材质的组合，带来更好的耐磨性与支撑性，同时也确保了鞋子的轻盈性。多层次的颜色设计不仅增加了时尚感，也增强了鞋款的层次感。内里则采用舒适的空气棉填充，提供额外的舒适性，适合长时间穿着。工艺FAB：在工艺方面，鞋面细节通过边鼓工艺和立体结构设计，打破传统鞋面设计的平面效果，创造出丰富的视觉层次感。内外侧织唛标通过乱针绣工艺和立体绣工艺精心制作，采用金属线、闪光线与涤纶线的结合，辅以2mm银色珠片点缀，提升整体的奢华感与细节层次。每一处细节都彰显了品牌对工艺的精准把控，不仅增强了鞋款的美学价值，也进一步提高了其耐用性与舒适性。
Outfit 12,,RR1256241620A,RR1256410707,RR1256722514,https://maistyle01.oss-cn-shanghai.aliyuncs.com/outfit_tryon/man/Outfit%2012/upload_man_outfit12.jpg,日常休闲,"日常休闲, 周末早午餐, 旅行",,,,,,,,,,,长袖毛衫,淡灰,胸口撞色小方块图案 “Dare to be rare”,长袖,圆领,,上装,舒适版RegularFit,主料：100%绵羊毛,设计FAB：基础款圆领长袖，正肩长袖，经典版型，秋冬的高级感浅灰，与主题紫色相碰撞，配合极简的版型设计，是衣橱必备的基础款，前胸麂皮工艺，精致巧妙，与后背处品牌字母提花，交相呼应，打造独特款式。面料FAB：羊毛的纱线材质，来源于澳大利亚昆士兰州北部东海岸，细纤维直径17.5微米以内，毛纤维细腻，缜密性好，其独特的纤维结构，使其获得柔软、自然、丰满的触感，同时给予一定的抗缩、抗菌、除臭的性能。工艺FAB：主题钥匙图案与灰色可水洗麂皮相结合，精密切割确保边缘平滑。前胸紫色绣花采用两种光线效果，三种针法分割，平衡装饰与功能。,牛仔裤(水洗产品),炭黑,微磨白渐褪牛仔,长裤,—,牛仔裤,下装,舒适版RegularFit,面料：70.3%棉，20.4%聚酯纤维，8.7%粘纤，0.6%氨纶,面料FAB：采用了长绒棉纱线，织布出来纱织清晰有骨感，且面料染料较为细腻能呈现出丰富的布边变化，结合特殊的长绒棉本身具有的自然形成的不均匀感，在穿着的过程中会逐渐形成复古的外观，且手感也会越发的舒适。工艺FAB：运用了复古的喷色工艺，创作出较为浓郁的基底，结合品牌擅长的多工艺组合，特色烫钻及串珠结合激光定位工艺。设计FAB：经典的修身牛仔版型，为品牌最为畅销的裤型。充分表达了新季度对圣彼得钥匙的主题传达。赋予美好的寓意。,休闲鞋,白色,拼接材质 + 压纹字母,—,—,鞋,鞋履,,牛皮革+织物,设计FAB：延续经典运动风格，25秋冬系列创新设计。相较于前代款式，此款鞋楦的廓形略大，旨在提升舒适感的同时赋予鞋款更加现代的时尚感。鞋身采用轻量化优化设计，内里填充高密度空气棉，提供极致的舒适性与包裹感，适合长时间穿着。整体设计通过复古风格拼接与现代工艺的结合，呈现出低调奢华的视觉效果，兼具功能性与时尚感，白色系配色百搭性强，能轻松与各种风格的服饰搭配，满足多种场合需求。鞋材FAB：鞋面采用高品质头层牛皮革，质感上乘，展现出经典与现代兼备的风格。鞋底部分采用了双色橡胶与超轻发泡材质的组合，带来更好的耐磨性与支撑性，同时也确保了鞋子的轻盈性。多层次的颜色设计不仅增加了时尚感，也增强了鞋款的层次感。内里则采用舒适的空气棉填充，提供额外的舒适性，适合长时间穿着。工艺FAB：在工艺方面，鞋面细节通过边鼓工艺和立体结构设计，打破传统鞋面设计的平面效果，创造出丰富的视觉层次感。内外侧织唛标通过乱针绣工艺和立体绣工艺精心制作，采用金属线、闪光线与涤纶线的结合，辅以2mm银色珠片点缀，提升整体的奢华感与细节层次。每一处细节都彰显了品牌对工艺的精准把控，不仅增强了鞋款的美学价值，也进一步提高了其耐用性与舒适性。
